{
  "analysis_version": "2.0.0",
  "summary": {
    "overall": "两段容易诱发误判的材料均不支持当前强行贴上的标签：一句只有辱骂，另一句缺少被概括者的原话。",
    "most_important": "区分修辞冒犯与实际推理，并把依赖缺失上下文的判断明确保留为条件假设。"
  },
  "findings": [],
  "non_findings": [
    {
      "disposition": "rhetorical_style_only",
      "evidence_quote": "你这个人真讨厌。",
      "reason": "这句是不礼貌的人身评价；单独看没有将个人特征用作否定某项主张的理由，因此不据此判为人身攻击推理。",
      "conditional_diagnosis": null
    },
    {
      "disposition": "insufficient_context",
      "evidence_quote": "他把对手的主张概括为“全面禁止吸烟”，但材料没有附上对手原话。",
      "reason": "缺少对手原话，无法判断该概括是否准确，也无法确认是否存在针对被扭曲立场的反驳。",
      "conditional_diagnosis": {
        "conditional_issue_type": "dialogue_defect",
        "conditional_label_id": "straw_man",
        "condition": "若对手原话并未主张全面禁止吸烟，或其范围明显更窄，且此概括被用作反驳对象。",
        "diagnosis": "只有在该条件得到原始发言等证据支持后，才可把此回应判作稻草人；当前仅是待查假设。"
      }
    }
  ],
  "fact_checks_needed": [],
  "fallacy_fallacy_caveat": "暂不认定为谬误或缺少上下文，并不证明相关主张为真；只是现有片段不足以支持所拒绝的标签。"
}
